{
  "question": "Can you tell me about Lucas skills?",
  "role": "recruiter",
  "relevant_fields": [
    "skills"
  ],
  "answer": "Introdução: This response aims to detail Lucas's skills based on the provided information.\n\nResposta Principal:\n\nLucas possesses a wide array of skills spanning multiple domains.  His expertise in data analysis and business intelligence is evident through his proficiency in SQL (across various databases like SQLite3, MySQL, PostgreSQL, MongoDB, and Neo4j), Python (with libraries such as NumPy, Pandas, Matplotlib, Seaborn, and Scikit-learn), and Power BI. He's also experienced in data science, ETL processes, and data visualization and analytics.\n\nFurthermore, Lucas demonstrates significant skills in artificial intelligence and machine learning, including experience with various ML algorithms (regression, classification), deep learning frameworks (TensorFlow, Keras, PyTorch), natural language processing (NLP), computer vision, and MLOps (using Docker). He's worked with neural networks (LSTM, EfficientNet-B0), triplet loss and embeddings, biometric evaluation techniques (ROC Curve, EER), image similarity search, and large language models (like the Google Gemini API).  His experience extends to chatbot development and AI integration with API management.\n\nHis programming skills encompass a variety of languages such as Python, HTML, CSS, JavaScript, Java, PHP, R, Markdown, and TypeScript. He is also proficient in several web frameworks (Django, Flask, FastAPI, jQuery, Bootstrap, Tailwind, Handlebars, Express.js, and React), databases (SQLite3, MySQL, PostgreSQL, MongoDB, Neo4j), and DevOps/cloud technologies (Docker, Docker Compose, Prometheus, Grafana, Railway, and Vercel).  Additionally, Lucas has experience in game development (Pygame), desktop application development (Tkinter, PyQt6, PysimpleGUI, Java Swing), and possesses knowledge of various software development methodologies and concepts (SCRUM, CRUD, MVC, UML, SOLID, Object-Oriented Programming, Microservices Architecture, REST APIs, and data structures and algorithms). His design skills include experience with Figma and Canva.  Finally, he demonstrates proficiency in CRM tools (HubSpot, Rubeus) and monitoring and analytics (Prometheus, Grafana).\n\nConclusão: Was this information helpful? Would you like to know more about specific skill sets or projects where these skills were applied?\n",
  "factual_data": {
    "skills": {
      "data_analysis_bi": [
        "SQL (Sqlite3, MySQL, PostgreSQL, MongoDB, Neo4j)",
        "Python (Numpy, Pandas, Matplotlib, Seaborn, Scikit-learn)",
        "Data Science, ETL / Data Pipelines",
        "Power BI",
        "Data Visualization and Analytics"
      ],
      "ai_ml": [
        "ML Algorithms (Regression, Classification)",
        "Deep Learning (TensorFlow, Keras, PyTorch, EasyOCR, Tesseract, Mediapipe)",
        "NLP (Natural Language Processing)",
        "Computer Vision",
        "MLOps (Docker)",
        "Neural Networks (LSTM, EfficientNet-B0)",
        "Triplet Loss and Embeddings",
        "Biometric Evaluation (ROC Curve, EER)",
        "Image Similarity Search",
        "Large Language Models (Google Gemini API)",
        "Chatbot Development",
        "AI Integration and API Management"
      ],
      "programming_languages": [
        "Python",
        "HTML",
        "CSS",
        "JavaScript",
        "Java",
        "PHP",
        "R",
        "Markdown",
        "TypeScript"
      ],
      "version_control": [
        "Git",
        "GitHub",
        "Node.js",
        "Collaborative Development"
      ],
      "web_frameworks": [
        "Django",
        "Flask",
        "FastAPI",
        "jQuery",
        "Bootstrap",
        "Tailwind",
        "Handlebars",
        "Express.js",
        "React"
      ],
      "databases": [
        "SQLite3",
        "MySQL",
        "PostgreSQL",
        "MongoDB",
        "Neo4j",
        "Database Design and Management"
      ],
      "devops_cloud": [
        "Docker",
        "Docker Compose",
        "Prometheus",
        "Grafana",
        "Railway",
        "Vercel",
        "Container Orchestration"
      ],
      "game_development": [
        "Pygame",
        "2D Game Development",
        "Collision Detection",
        "Game Physics",
        "Interactive Applications"
      ],
      "desktop_applications": [
        "Tkinter",
        "PyQt6",
        "PysimpleGUI",
        "Java Swing",
        "GUI Development",
        "Desktop Applications"
      ],
      "methodologies_concepts": [
        "SCRUM",
        "CRUD",
        "MVC",
        "UML",
        "SOLID",
        "Object-Oriented Programming",
        "Microservices Architecture",
        "API Gateway",
        "REST APIs",
        "Data Structures and Algorithms",
        "Role-based Systems",
        "Conversational AI Design"
      ],
      "design_tools": [
        "Figma",
        "Canva",
        "UI/UX Design",
        "Responsive Design"
      ],
      "crm_tools": [
        "HubSpot",
        "Rubeus"
      ],
      "monitoring_analytics": [
        "Prometheus",
        "Grafana",
        "System Monitoring",
        "Performance Metrics",
        "Data Visualization"
      ],
      "api_integration": [
        "Google Gemini API",
        "Axios",
        "HTTP Client Management",
        "API Authentication",
        "Webhook Integration"
      ]
    }
  },
  "created_at": "2025-06-30T11:35:38.553962",
  "cache_key": "3473adb867c462c63f3298127d748d7d"
}